<?xml version="1.0" encoding="UTF-8"?>
<?xml-stylesheet type="text/xsl" href="./registry.xsl"?>
<registry xmlns="urn:nena:xml:namespace:nrs" id="nrs" registrar="nena" xmlns:xsi="http://www.w3.org/2001/XMLSchema-instance" xsi:schemaLocation="urn:nena:xml:namespace:nrs registry.xsd">
	<title>NENA Registry System</title>
	<created>2009-09-17</created>
	<updated>2009-09-17</updated>
    <registry ref="../nrs">NRS</registry>
	<references>
        <xref type="nena" data="nena_registry_system">70-001</xref>
    </references>
	<registration_rule>NENA Technical Standard Required</registration_rule>
	<description>When developing and deploying technical standards which employ enumerations, or lists of values, where the enumeration or lists can reasonably be expected to change over time as new technology, vendors, service providers or other stakeholders evolve, a known stable way to maintain the current acceptable values in the enumeration or list is required. The values in the enumeration or list are called a registry.</description>
	<note>Creating a registry involves describing the registry to be created, an initial set of assignments (if appropriate), and guidelines on how future assignments are to be made. Registries to be managed by NRS must be created in a full NENA Technical Standard.</note>
	<records>
		<record>
			<value>urn:nena</value>
			<description>The IETF has delegated to NRS the urn:nena namespace.</description>
            <registry ref="urn/nena">urn:nena</registry>
            <references>
                <xref type="rfc" data="rfc6061"/>
            </references>
            <date>2011-01-01</date>
		</record>
		<record>
			<value>elementState</value>
			<description>An enumerated value of the current state of an agency or element</description>
            <registry ref="elementState"/>
            <references>
                <xref type="nena" data="i3_Stage3">08-003 v1</xref>
            </references>
            <date>2011-06-14</date>
		</record>
		<record>
			<value>serviceState</value>
			<description>ServiceState is an event that indicates the state of service either automatically determined, or as determined by management.</description>
            <registry ref="serviceState"/>
            <references>
                <xref type="nena" data="i3_Stage3">08-003 v1</xref>
            </references>
            <date>2011-06-14</date>
		</record>
		<record>
			<value>securityPosture</value>
			<description></description>
            <registry ref="securityPosture"/>
            <references>
                <xref type="nena" data="i3_Stage3">08-003 v1</xref>
            </references>
            <date>2011-06-14</date>
		</record>
		<record>
			<value>ExternalEvenetCodes</value>
			<description></description>
            <registry ref="ExternalEventCodes">ExternalEventCodes</registry>
            <references>
                <xref type="nena" data="i3_Stage3">08-003 v1</xref>
            </references>
            <date>2011-06-14</date>
		</record>
		<record>
			<value>EsrpNotifyEventCodes</value>
			<description></description>
            <registry ref="EsrpNotifyEventCodes">EsrpNotifyEventCodes</registry>
            <references>
                <xref type="nena" data="i3_Stage3">08-003 v1</xref>
            </references>
            <date>2011-06-14</date>
		</record>
		<record>
			<value>RouteCause</value>
			<description></description>
            <registry ref="RouteCause"/>
            <references>
                <xref type="nena" data="i3_Stage3">08-003 v1</xref>
            </references>
            <date>2011-06-14</date>
		</record>
		<record>
			<value>LogEvent</value>
			<description></description>
            <registry ref="LogEvent"/>
            <references>
                <xref type="nena" data="i3_Stage3">08-003 v1</xref>
            </references>
            <date>2011-06-14</date>
		</record>
		<record>
			<value>AgencyRoles</value>
			<description></description>
            <registry ref="AgencyRoles"/>
            <references>
                <xref type="nena" data="i3_Stage3">08-003 v1</xref>
            </references>
            <date>2011-06-14</date>
		</record>
		<record>
			<value>AgentRoles</value>
			<description></description>
            <registry ref="AgentRoles"/>
            <references>
                <xref type="nena" data="i3_Stage3">08-003 v1</xref>
            </references>
            <date>2011-06-14</date>
		</record>
		<record>
			<value>ServiceDeliveredByProviderToEndUser</value>
			<description></description>
            <registry ref="ServiceDeliveredByProviderToEndUser"/>
            <references>
                <xref type="nena" data="i3_Stage3">08-003 v1</xref>
            </references>
            <date>2011-06-14</date>
		</record>
		<record>
			<value>DeviceClassification</value>
			<description></description>
            <registry ref="DeviceClassification"/>
            <references>
                <xref type="nena" data="NG911_AdditionalData">71-001 v1</xref>
            </references>
            <date>2009-09-17</date>
		</record>
		<record>
			<value>DeviceManufacturer</value>
			<description></description>
            <registry ref="DeviceManufacturer"/>
            <references>
                <xref type="nena" data="NG911_AdditionalData">71-001 v1</xref>
            </references>
            <date>2009-09-17</date>
		</record>
		<record>
			<value>TypeOfDeviceIdentifier</value>
			<description></description>
            <registry ref="TypeOfDeviceIdentifier"/>
            <references>
                <xref type="nena" data="NG911_AdditionalData">71-001 v1</xref>
            </references>
            <date>2009-09-17</date>
		</record>
		<record>
			<value>DeviceSpecificSchema</value>
			<description></description>
            <registry ref="DeviceSpecificSchema"/>
            <references>
                <xref type="nena" data="NG911_AdditionalData">71-001 v1</xref>
            </references>
            <date>2009-09-17</date>
		</record>
		<record>
			<value>StreetPrePostModifiers</value>
			<description></description>
            <registry ref="StreetPrePostModifiers"/>
            <references>
                <xref type="uri" data="https://nena.webexone.com/r.asp?a=5&amp;id=118741">NENA 71-002 Draft</xref>
            </references>
            <date>2011-01-19</date>
		</record>
		<record>
			<value>StreetPrefixSuffix</value>
			<description></description>
            <registry ref="StreetPrefixSuffix"/>
            <references>
                <xref type="uri" data="https://nena.webexone.com/r.asp?a=5&amp;id=118741">NENA 71-002 Draft</xref>
            </references>
            <date>2011-01-19</date>
		</record>
		<record>
			<value>ManagementPolicy</value>
			<description>NRS Management Policies</description>
            <registry ref="ManagementPolicy"/>
            <references>
                <xref type="nena" data="nena_registry_system">70-001</xref>
            </references>
            <date>2009-09-17</date>
		</record>
	</records>
</registry>
