<?xml version="1.0" encoding="UTF-8"?>
<?xml-stylesheet type="text/xsl" href="./registry.xsl"?>
<registry xmlns="urn:nena:xml:namespace:nrs" id="elementState" registrar="nena" xmlns:xsi="http://www.w3.org/2001/XMLSchema-instance" xsi:schemaLocation="urn:nena:xml:namespace:nrs registry.xsd">
	<title>DeviceClassification</title>
	<created>2009-09-17</created>
	<updated>2009-09-17</updated>
    <registry ref="../../nrs">NRS</registry>
    <references>
        <xref type="nena" data="NG911_AdditionalData">71-001 v1</xref>
    </references>
	<registration_rule>NENA Technical Standard Required</registration_rule>
	<description>If the device provides the data structure, the device information should be provided. If the Service Provider provides the structure and it knows what the device is, the Service
	Provider should provide the device information. Often the carrier does not know what the device is. It is possible to receive 2 data structures, one created by the device and one created by the Service Provider.   Information about the device, not how itâ€™s being used.
	</description>
	<note>A new entry to DeviceClassification requires a description of the value, and justification for adding a new classification.  Requires an update to NENA 71-001.</note>
	<records>
		<record>
			<value>Cordless handset</value>
			<description></description>
            <references>
                <xref type="nena" data="NG911_AdditionalData">71-001 v1</xref>
            </references>
            <date>2011-06-14</date>
		</record>
		<record>
			<value>Fixed phone</value>
			<description></description>
            <references>
                <xref type="nena" data="NG911_AdditionalData">71-001 v1</xref>
            </references>
            <date>2011-06-14</date>
		</record>
		<record>
			<value>Mobile handset</value>
			<description></description>
            <references>
                <xref type="nena" data="NG911_AdditionalData">71-001 v1</xref>
            </references>
            <date>2011-06-14</date>
		</record>
		<record>
			<value>ATA</value>
			<description>Analog Terminal Adapter</description>
            <references>
                <xref type="nena" data="NG911_AdditionalData">71-001 v1</xref>
            </references>
            <date>2011-06-14</date>
		</record>
		<record>
			<value>Satellite phone</value>
			<description></description>
            <references>
                <xref type="nena" data="NG911_AdditionalData">71-001 v1</xref>
            </references>
            <date>2011-06-14</date>
		</record>
		<record>
			<value>Stationary computing device</value>
			<description>Alarm system, data sensor, etc.</description>
            <references>
                <xref type="nena" data="NG911_AdditionalData">71-001 v1</xref>
            </references>
            <date>2011-06-14</date>
		</record>
		<record>
			<value>Guardian devices</value>
			<description></description>
            <references>
                <xref type="nena" data="NG911_AdditionalData">71-001 v1</xref>
            </references>
            <date>2011-06-14</date>
		</record>
		<record>
			<value>Desktop PC</value>
			<description></description>
            <references>
                <xref type="nena" data="NG911_AdditionalData">71-001 v1</xref>
            </references>
            <date>2011-06-14</date>
		</record>
		<record>
			<value>Laptop computing device</value>
			<description></description>
            <references>
                <xref type="nena" data="NG911_AdditionalData">71-001 v1</xref>
            </references>
            <date>2011-06-14</date>
		</record>
		<record>
			<value>Tablet computing device</value>
			<description></description>
            <references>
                <xref type="nena" data="NG911_AdditionalData">71-001 v1</xref>
            </references>
            <date>2011-06-14</date>
		</record>
		<record>
			<value>Alarm System</value>
			<description></description>
            <references>
                <xref type="nena" data="NG911_AdditionalData">71-001 v1</xref>
            </references>
            <date>2011-06-14</date>
		</record>
		<record>
			<value>Data sensor</value>
			<description></description>
            <references>
                <xref type="nena" data="NG911_AdditionalData">71-001 v1</xref>
            </references>
            <date>2011-06-14</date>
		</record>
		<record>
			<value>Personal beacons</value>
			<description>SPOT, etc.</description>
            <references>
                <xref type="nena" data="NG911_AdditionalData">71-001 v1</xref>
            </references>
            <date>2011-06-14</date>
		</record>
		<record>
			<value>Auto telematics</value>
			<description>Indicates VEDS dataset.</description>
            <references>
                <xref type="nena" data="NG911_AdditionalData">71-001 v1</xref>
            </references>
            <date>2011-06-14</date>
		</record>
		<record>
			<value>Trucking telematics</value>
			<description></description>
            <references>
                <xref type="nena" data="NG911_AdditionalData">71-001 v1</xref>
            </references>
            <date>2011-06-14</date>
		</record>
		<record>
			<value>Marine telematics</value>
			<description></description>
            <references>
                <xref type="nena" data="NG911_AdditionalData">71-001 v1</xref>
            </references>
            <date>2011-06-14</date>
		</record>
		<record>
			<value>Personal Digital Assistant</value>
			<description>PDA</description>
            <references>
                <xref type="nena" data="NG911_AdditionalData">71-001 v1</xref>
            </references>
            <date>2011-06-14</date>
		</record>
		<record>
			<value>Personal Navigation Device</value>
			<description>PND</description>
            <references>
                <xref type="nena" data="NG911_AdditionalData">71-001 v1</xref>
            </references>
            <date>2011-06-14</date>
		</record>
		<record>
			<value>Smart phone</value>
			<description>Blackberry, PDAs</description>
            <references>
                <xref type="nena" data="NG911_AdditionalData">71-001 v1</xref>
            </references>
            <date>2011-06-14</date>
		</record>
		<record>
			<value>Internet tablet</value>
			<description></description>
            <references>
                <xref type="nena" data="NG911_AdditionalData">71-001 v1</xref>
            </references>
            <date>2011-06-14</date>
		</record>
		<record>
			<value>Gaming console</value>
			<description></description>
            <references>
                <xref type="nena" data="NG911_AdditionalData">71-001 v1</xref>
            </references>
            <date>2011-06-14</date>
		</record>
		<record>
			<value>Video phone</value>
			<description></description>
            <references>
                <xref type="nena" data="NG911_AdditionalData">71-001 v1</xref>
            </references>
            <date>2011-06-14</date>
		</record>
		<record>
			<value>Other text device</value>
			<description></description>
            <references>
                <xref type="nena" data="NG911_AdditionalData">71-001 v1</xref>
            </references>
            <date>2011-06-14</date>
		</record>
		<record>
			<value>Not available</value>
			<description></description>
            <references>
                <xref type="nena" data="NG911_AdditionalData">71-001 v1</xref>
            </references>
            <date>2011-06-14</date>
		</record>
    </records>
</registry>
